{
  "id": "mitchell-2013-mindfulness",
  "author": "Mitchell, J. T., McIntyre, E. M., English, J. S., Dennis, M. F., Beckham, J. C., & Kollins, S. H.",
  "year": 2013,
  "title": "A pilot trial of mindfulness meditation training for ADHD in adulthood: Impact on core symptoms, executive functioning, and emotion dysregulation",
  "publication": "Journal of Attention Disorders, 21(13), 1105-1120",
  "doi": "10.1177/1087054713513328",
  "source_type": "pilot_study",
  "access_status": "blocked_404",
  "evidence_role": "contextual_background",
  "note": "Kullanıcı atfı '17(2):110-119' YANLIŞ — gerçek cilt/sayfa 21(13):1105-1120 (online 2013). Tam metin erişilemez; MVP'de cite edilmez."
}
