{
  "id": "knouse-safren-2010",
  "author": "Knouse, L. E., & Safren, S. A.",
  "year": 2010,
  "title": "Current status of cognitive behavioral therapy for adult attention-deficit hyperactivity disorder",
  "publication": "Psychiatric Clinics of North America, 33(3), 497-509",
  "doi": "10.1016/j.psc.2010.04.001",
  "pmid": "20599129",
  "source_type": "literature_review",
  "access_status": "blocked_404",
  "evidence_role": "contextual_background",
  "note": "PMID/DOI Crossref+PubMed'de doğrulandı. Tam metin erişilemez; MVP'de cite edilmez."
}
