{
  "id": "solanto-2008-mct",
  "author": "Solanto, M. V., Marks, D. J., Mitchell, K. J., Wasserstein, J., & Kofman, M. D.",
  "year": 2008,
  "title": "Development of a new psychosocial treatment for adult ADHD",
  "publication": "Journal of Attention Disorders, 11(6), 728-736",
  "doi": "10.1177/1087054707305100",
  "source_type": "pilot_study",
  "access_status": "verified_accessible",
  "evidence_role": "efficacy_evidence",
  "note": "Pre/post development study (n=30, kontrol grubu YOK) — randomized efficacy trial değil. CAARS inattentive p<.001, Brown ADD p<.001."
}
