{
  "id": "dupaul-stoner-2016",
  "author": "DuPaul, G. J., & Stoner, G.",
  "year": 2016,
  "title": "ADHD in the schools: Assessment and intervention strategies (3rd ed.)",
  "publication": "Guilford Press",
  "isbn": "9781462526000",
  "source_type": "school_intervention_guide",
  "access_status": "verified_accessible",
  "evidence_role": "assessment_reference",
  "note": "Guilford sayfasında doğrulandı (paperback ISBN 9781462526000). Yetişkin self-help dışı; MVP'de cite edilmez."
}
