{
  "id": "safren-2010-cbt-rct",
  "author": "Safren, S. A., Sprich, S., Mimiaga, M. J., Surman, C., Knouse, L., & Otto, M. W.",
  "year": 2010,
  "title": "Cognitive behavioral therapy vs relaxation with educational support for medication-treated adults with ADHD and persistent symptoms: A randomized controlled trial",
  "publication": "JAMA, 304(8), 875-880",
  "doi": "10.1001/jama.2010.1192",
  "pmid": "20736471",
  "source_type": "rct",
  "access_status": "verified_accessible",
  "evidence_role": "efficacy_evidence",
  "note": "Kullanıcı listesindeki 186352 URL'si bir MMWR makalesine (reçeteli ilaç ED başvuruları) çözülüyordu — Safren RCT'si değil. Canonical kayıt PMID 20736471 / DOI 10.1001/jama.2010.1192'dir; [4]/[8]/[15]/[21] girdileri bu tek kayda dedupe edilir. NCT00118911."
}
