{
  "id": "kendall-braswell-1993",
  "author": "Kendall, P. C., & Braswell, L.",
  "year": 1993,
  "title": "Cognitive-behavioral therapy for impulsive children (2nd ed.)",
  "publication": "Guilford Press",
  "isbn": "9780898620138",
  "source_type": "clinical_manual",
  "access_status": "blocked_404",
  "evidence_role": "foundational_framework",
  "note": "ISBN kullanıcı URL'sinden; Guilford 404. ISBN-10 kontrolü Faz 1'de yapılacak. Tarihsel/çocuk odaklı; MVP'de cite edilmez."
}
