{
  "id": "ramsay-rostain-2015",
  "author": "Ramsay, J. R., & Rostain, A. L.",
  "year": 2015,
  "title": "Cognitive behavioral therapy for adult ADHD: An integrative psychosocial and medical approach (2nd ed.)",
  "publication": "Routledge",
  "isbn": "9781135072186",
  "source_type": "clinical_manual",
  "access_status": "verified_accessible",
  "evidence_role": "foundational_framework",
  "note": "2nd ed basımı 2014-09-25 (Google Books); atıf 2015. Taylor & Francis TOC + abstract doğrulandı; kitap metni erişilemez."
}
