{
  "id": "barkley-2015",
  "author": "Barkley, R. A. (Ed.)",
  "year": 2015,
  "title": "Attention-deficit hyperactivity disorder: A handbook for diagnosis and treatment (4th ed.)",
  "publication": "Guilford Press",
  "isbn": "9781462517725",
  "source_type": "handbook",
  "access_status": "verified_accessible",
  "evidence_role": "mechanism",
  "note": "Guilford sayfasında doğrulandı (hardcover ISBN 9781462517725, Ekim 2014 basım; atıf 2015)."
}
