{
  "id": "antshel-barkley-2015",
  "author": "Antshel, K. M., & Barkley, R. A.",
  "year": 2015,
  "title": "Psychosocial interventions in attention-deficit/hyperactivity disorder: Update",
  "publication": "Child and Adolescent Psychiatric Clinics of North America, 24(1), 79-97",
  "doi": "10.1016/j.chc.2014.08.002",
  "pmid": "25455577",
  "source_type": "literature_review",
  "access_status": "blocked_404",
  "evidence_role": "contextual_background",
  "note": "Kullanıcı atfı '2020, 29(3)' YANLIŞ — gerçek kayıt 2015 Update (PMID 25455577). Tam metin erişilemez; MVP'de cite edilmez."
}
