{
  "id": "sprich-2016-adolescent",
  "author": "Sprich, S., Safren, S. A., Finkelstein, D., Remmert, J. E., & Hammerness, P.",
  "year": 2016,
  "title": "A randomized controlled trial of cognitive behavioral therapy for ADHD in medication-treated adolescents",
  "publication": "Journal of Child Psychology and Psychiatry, 57(3), 275-283",
  "doi": "10.1111/jcpp.12549",
  "pmid": "26990084",
  "source_type": "rct",
  "access_status": "blocked_404",
  "evidence_role": "population_extension",
  "note": "Kullanıcı atfı 'J Clin Psychiatry 77(11):1449-1455' YANLIŞ — gerçek yayın JCPP 57(3):275-283. Tam metin erişilemez; MVP'de cite edilmez."
}
